Name,Speech,verse_number,inferred_verse_number,lemmata
Αἵμων,τί γὰρ πατρὸς θάλλοντος εὐκλείας τέκνοις,,703.0,τίς γάρ πατήρ θάλλω εὔκλεια τέκνον
Αἵμων,"ἄγαλμα μεῖζον, ἢ τί πρὸς παίδων πατρί;",,704.0,ἄγαλμα μέγας ἤ τίς πρός παῖς πατήρ
Αἵμων,"μή νυν ἓν ἦθος μοῦνον ἐν σαυτῷ φόρει,",705.0,705.0,μή νῦν εἷς ἦθος μόνος ἐν σαυτοῦ φορέω
Αἵμων,"ὡς φὴς σύ, κοὐδὲν ἄλλο, τοῦτ᾽ ὀρθῶς ἔχειν.",,706.0,ὡς φημί σύ οὐδείς ἄλλος τοῦτ ὀρθός ἔχω
Αἵμων,"ὅστις γὰρ αὐτὸς ἢ φρονεῖν μόνος δοκεῖ,",,707.0,ὅστις γάρ αὐτός ἤ φρονέω μόνος δοκέω
Αἵμων,"ἢ γλῶσσαν, ἣν οὐκ ἄλλος, ἢ ψυχὴν ἔχειν,",,708.0,ἤ γλῶσσα ὅς οὐ ἄλλος ἤ ψυχή ἔχω
Αἵμων,οὗτοι διαπτυχθέντες ὤφθησαν κενοί.,,709.0,οὗτος διαπτύσσω ὁράω κενός
Αἵμων,"ἀλλ᾽ ἄνδρα, κεἴ τις ᾖ σοφός, τὸ μανθάνειν",710.0,710.0,ἀλλ ἀνήρ εἰ τις εἰμί σοφός ὁ μανθάνω
Αἵμων,"πόλλ᾽, αἰσχρὸν οὐδὲν καὶ τὸ μὴ τείνειν ἄγαν.",,711.0,πόλλ αἰσχρός οὐδείς καί ὁ μή τείνω ἄγαν
Αἵμων,ὁρᾷς παρὰ ῥείθροισι χειμάρροις ὅσα,,712.0,ὁράω παρά ῥεῖθρον χειμάρρους ὅσος
Αἵμων,"δένδρων ὑπείκει, κλῶνας ὡς ἐκσῴζεται,",,713.0,δένδρον ὑπείκω κλών ὡς ἐκσῴζω
Αἵμων,τὰ δ᾽ ἀντιτείνοντ᾽ αὐτόπρεμν᾽ ἀπόλλυται.,,714.0,ὁ δ ἀντιτείνοντ αὐτόπρεμν ἀπόλλυμι
Αἵμων,αὕτως δὲ ναὸς ὅστις ἐγκρατῆ πόδα,715.0,715.0,αὔτος δέ ναῦς ὅστις ἐγκρατής πούς
Αἵμων,"τείνας ὑπείκει μηδέν, ὑπτίοις κάτω",,716.0,τείνω ὑπείκω μηδείς ὕπτιος κάτω
Αἵμων,στρέψας τὸ λοιπὸν σέλμασιν ναυτίλλεται.,,717.0,στρέφω ὁ λοιπός σέλμα ναυτίλλομαι
Αἵμων,ἀλλ᾽ εἶκε καὶ θυμῷ μετάστασιν δίδου.,,718.0,ἀλλ εἴκω καί θυμός μετάστασις δίδωμι
Αἵμων,γνώμη γὰρ εἴ τις κἀπ᾽ ἐμοῦ νεωτέρου,,719.0,γνώμη γάρ εἰ τις ἀπό ἐγώ νεώτερος
Αἵμων,"πρόσεστι, φήμ᾽ ἔγωγε πρεσβεύειν πολὺ",720.0,720.0,πρόσειμι φήμ ἐγώ πρεσβεύω πολύς
Αἵμων,φῦναι τὸν ἄνδρα πάντ᾽ ἐπιστήμης πλέων:,,721.0,φύω ὁ ἀνήρ πάντ ἐπιστήμη πλέω
Αἵμων,"εἰ δ᾽ οὖν, φιλεῖ γὰρ τοῦτο μὴ ταύτῃ ῥέπειν,",,722.0,εἰ δ οὖν φιλέω γάρ οὗτος μή οὗτος ῥέπω
Αἵμων,καὶ τῶν λεγόντων εὖ καλὸν τὸ μανθάνειν.,,723.0,καί ὁ λέγω εὖ καλός ὁ μανθάνω
Χορός,"ἄναξ, σέ τ᾽ εἰκός, εἴ τι καίριον λέγει,",,724.0,ἄναξ σύ τ ἔοικα εἰ τις καίριος λέγω
Χορός,"μαθεῖν, σέ τ᾽ αὖ τοῦδ᾽:  εὖ γὰρ εἴρηται διπλῇ.",725.0,725.0,μανθάνω σύ τ αὖ τοῦδ  εὖ γάρ ἐρῶ διπλός
Κρέων,οἱ τηλικοίδε καὶ διδαξόμεσθα δὴ,,726.0,ὁ τηλικόσδε καί διδάσκω δή
Κρέων,φρονεῖν ὑπ᾽ ἀνδρὸς τηλικοῦδε τὴν φύσιν;,,727.0,φρονέω ὑπό ἀνήρ τηλικόσδε ὁ φύσις
Αἵμων,"μηδὲν τὸ μὴ δίκαιον:  εἰ δ᾽ ἐγὼ νέος,",,728.0,μηδείς ὁ μή δίκαιος  εἰ δ ἐγώ νέος
Αἵμων,οὐ τὸν χρόνον χρὴ μᾶλλον ἢ τἄργα σκοπεῖν.,,729.0,οὐ ὁ χρόνος χρή μᾶλλον ἤ ἔργον σκοπέω
Κρέων,ἔργον γάρ ἐστι τοὺς ἀκοσμοῦντας σέβειν;,730.0,730.0,ἔργον γάρ εἰμί ὁ ἀκοσμέω σέβω
Αἵμων,"οὐδ᾽ ἂν κελεύσαιμ᾽, εὐσεβεῖν εἰς τοὺς κακούς.",,731.0,οὐδ ἄν κελεύσαιμ εὐσεβέω εἰς ὁ κακός
Κρέων,οὐχ ἥδε γὰρ τοιᾷδ᾽ ἐπείληπται νόσῳ;,,732.0,οὐ ὅδε γάρ τοιᾷδ ἐπιλαμβάνω νόσος
Αἵμων,οὔ φησι Θήβης τῆσδ᾽ ὁμόπτολις λεώς.,,733.0,οὐ φημί Θήβη τῆσδ ὁμόπολις λαός
Κρέων,πόλις γὰρ ἡμῖν ἁμὲ χρὴ τάσσειν ἐρεῖ;,,734.0,πόλις γάρ ἐγώ ἐγώ χρή τάσσω ἐρῶ
Αἵμων,ὁρᾷς τόδ᾽ ὡς εἴρηκας ὡς ἄγαν νέος;,735.0,735.0,ὁράω τόδ ὡς ἐρῶ ὡς ἄγαν νέος
Κρέων,ἄλλῳ γὰρ ἢ 'μοὶ χρή με τῆσδ᾽ ἄρχειν χθονός;,,736.0,ἄλλος γάρ ἤ ἐγώ χρή ἐγώ τῆσδ ἄρχω χθών
Αἵμων,πόλις γὰρ οὐκ ἔσθ᾽ ἥτις ἀνδρός ἐσθ᾽ ἑνός.,,737.0,πόλις γάρ οὐ εἰμί ὅστις ἀνήρ εἰμί εἷς
Κρέων,οὐ τοῦ κρατοῦντος ἡ πόλις νομίζεται;,,738.0,οὐ ὁ κρατέω ὁ πόλις νομίζω
Αἵμων,καλῶς γ᾽ ἐρήμης ἂν σὺ γῆς ἄρχοις μόνος.,,739.0,καλός γε ἐρῆμος ἄν σύ γῆ ἄρχω μόνος
Κρέων,"ὅδ᾽, ὡς ἔοικε, τῇ γυναικὶ συμμαχεῖ.",740.0,740.0,ὅδ ὡς ἔοικα ὁ γυνή συμμαχέω
Αἵμων,εἴπερ γυνὴ σύ.  σοῦ γὰρ οὖν προκήδομαι.,,741.0,εἴπερ γυνή σύ  σύ γάρ οὖν προκήδομαι
Κρέων,"ὦ παγκάκιστε, διὰ δίκης ἰὼν πατρί;",,742.0,ὦ πάγκακος διά δίκη εἶμι πατήρ
Αἵμων,οὐ γὰρ δίκαιά σ᾽ ἐξαμαρτάνονθ᾽ ὁρῶ.,,743.0,οὐ γάρ δίκαιος σ ἐξαμαρτάνονθ ὁράω
Κρέων,ἁμαρτάνω γὰρ τὰς ἐμὰς ἀρχὰς σέβων;,,744.0,ἁμαρτάνω γάρ ὁ ἐμός ἀρχή σέβω
Αἵμων,οὐ γὰρ σέβεις τιμάς γε τὰς θεῶν πατῶν.,745.0,745.0,οὐ γάρ σέβω τιμή γε ὁ θεός πατέω
Κρέων,ὦ μιαρὸν ἦθος καὶ γυναικὸς ὕστερον.,,746.0,ὦ μιαρός ἦθος καί γυνή ὕστερος
Αἵμων,οὔ τἂν ἕλοις ἥσσω γε τῶν αἰσχρῶν ἐμέ.,,747.0,οὐ ἄν αἱρέω ἥσσων γε ὁ αἰσχρός ἐγώ
Κρέων,ὁ γοῦν λόγος σοι πᾶς ὑπὲρ κείνης ὅδε.,,748.0,ὁ γοῦν λόγος σύ πᾶς ὑπέρ ἐκεῖνος ὅδε
Αἵμων,"καὶ σοῦ γε κἀμοῦ, καὶ θεῶν τῶν νερτέρων.",,749.0,καί σύ γε ἐγώ καί θεός ὁ νέρτερος
Κρέων,ταύτην ποτ᾽ οὐκ ἔσθ᾽ ὡς ἔτι ζῶσαν γαμεῖς.,750.0,750.0,οὗτος ποτ οὐ εἰμί ὡς ἔτι ζάω γαμέω
Αἵμων,ἣ δ᾽ οὖν θανεῖται καὶ θανοῦσ᾽ ὀλεῖ τινα.,,751.0,ὁ δ οὖν θνήσκω καί θανοῦσ ὄλλυμι τις
Κρέων,ἦ κἀπαπειλῶν ὧδ᾽ ἐπεξέρχει θρασύς;,,752.0,εἰμί ἐπαπειλέω ὧδ ἐπεξέρχει θρασύς
Αἵμων,τίς δ᾽ ἔστ᾽ ἀπειλὴ πρὸς κενὰς γνώμας λέγειν;,,753.0,τις δ εἰμί ἀπειλή πρός κενός γνώμη λέγω
Κρέων,"κλαίων φρενώσεις, ὢν φρενῶν αὐτὸς κενός.",,754.0,κλαίω φρενόω εἰμί φρήν αὐτός κενός
Αἵμων,"εἰ μὴ πατὴρ ἦσθ᾽, εἶπον ἄν σ᾽ οὐκ εὖ φρονεῖν.",755.0,755.0,εἰ μή πατήρ εἰμί εἶπον ἀνά σ οὐ εὖ φρονέω
Κρέων,γυναικὸς ὢν δούλευμα μὴ κώτιλλέ με.,,756.0,γυνή εἰμί δούλευμα μή κωτίλλω ἐγώ
Αἵμων,βούλει λέγειν τι καὶ λέγων μηδὲν κλύειν;,,757.0,βούλομαι λέγω τις καί λέγω μηδείς κλύω
Κρέων,"ἄληθες; ἀλλ᾽ οὐ τόνδ᾽ Ὄλυμπον, ἴσθ᾽ ὅτι,",,758.0,ἀληθής ἀλλ οὐ τόνδ Ὄλυμπος εἰμί ὅτι
Κρέων,χαίρων ἐπὶ ψόγοισι δεννάσεις ἐμέ.,,759.0,χαίρω ἐπί ψόγος δεννάζω ἐγώ
Κρέων,ἄγαγε τὸ μῖσος ὡς κατ᾽ ὄμματ᾽ αὐτίκα,760.0,760.0,ἄγω ὁ μῖσος ὡς κατά ὄμματ αὐτίκα
Κρέων,παρόντι θνῄσκῃ πλησία τῷ νυμφίῳ.,,761.0,πάρειμι θνήσκω πλήσιος ὁ νυμφίος
Αἵμων,"οὐ δῆτ᾽ ἔμοιγε, τοῦτο μὴ δόξῃς ποτέ,",,762.0,οὐ δῆτ ἐγώ οὗτος μή δοκέω ποτέ
Αἵμων,"οὔθ᾽ ἥδ᾽ ὀλεῖται πλησία, σύ τ᾽ οὐδαμὰ",,763.0,οὔθ ἥδ ὄλλυμι πλήσιος σύ τ οὐδαμός
Αἵμων,"τοὐμὸν προσόψει κρᾶτ᾽ ἐν ὀφθαλμοῖς ὁρῶν,",,764.0,ἐμός προσοράω κρᾶτ ἐν ὀφθαλμός ὁράω
Αἵμων,ὡς τοῖς θέλουσι τῶν φίλων μαίνῃ συνών.,765.0,765.0,ὡς ὁ ἐθέλω ὁ φίλος μαίνομαι σύνειμι
Χορός,"ἁνήρ, ἄναξ, βέβηκεν ἐξ ὀργῆς ταχύς:",,766.0,ἀνήρ ἄναξ βαίνω ἐκ ὀργή ταχύς
Χορός,νοῦς δ᾽ ἐστὶ τηλικοῦτος ἀλγήσας βαρύς.,,767.0,νόος δ εἰμί τηλικοῦτος ἀλγέω βαρύς
Κρέων,δράτω:  φρονείτω μεῖζον ἢ κατ᾽ ἄνδρ᾽ ἰών:,,768.0,δράω  φρονέω μέγας ἤ κατά ἄνδρ εἰμί
Κρέων,τὼ δ᾽ οὖν κόρα τώδ᾽ οὐκ ἀπαλλάξει μόρου.,,769.0,ὁ δ οὖν κόρη τώδ οὐ ἀπαλλάσσω μόρος
Χορός,ἄμφω γὰρ αὐτὼ καὶ κατακτεῖναι νοεῖς;,770.0,770.0,ἄμφω γάρ αὐτός καί κατακτείνω νοέω
Κρέων,οὐ τήν γε μὴ θιγοῦσαν:  εὖ γὰρ οὖν λέγεις.,,771.0,οὐ ὁ γε μή θιγγάνω  εὖ γάρ οὖν λέγω
Χορός,μόρῳ δὲ ποίῳ καί σφε βουλεύει κτανεῖν;,,772.0,μόρος δέ ποῖος καί σφεῖς βουλεύω κτείνω
Κρέων,ἄγων ἔρημος ἔνθ᾽ ἂν ᾖ βροτῶν στίβος,,773.0,ἄγω ἐρῆμος εἰμί ἄν εἰμί βροτός στίβος
Κρέων,"κρύψω πετρώδει ζῶσαν ἐν κατώρυχι,",,774.0,κρύπτω πετρώδης ζάω ἐν κατῶρυξ
Κρέων,"φορβῆς τοσοῦτον ὡς ἄγος μόνον προθείς,",775.0,775.0,φορβή τοσοῦτος ὡς ἄγος μόνος προθέω
Κρέων,ὅπως μίασμα πᾶσ᾽ ὑπεκφύγῃ πόλις.,,776.0,ὅπως μίασμα πᾶσ ὑπεκφεύγω πόλις
Κρέων,"κἀκεῖ τὸν Ἅιδην, ὃν μόνον σέβει θεῶν,",,777.0,ἐκεῖ ὁ ᾍδης ὅς μόνος σέβω θεός
Κρέων,"αἰτουμένη που τεύξεται τὸ μὴ θανεῖν,",,778.0,αἰτέω πού τυγχάνω ὁ μή θνήσκω
Κρέων,ἢ γνώσεται γοῦν ἀλλὰ τηνικαῦθ᾽ ὅτι,,779.0,ἤ γιγνώσκω γοῦν ἀλλά τηνικαῦθ ὅτι
Κρέων,πόνος περισσός ἐστι τἀν Ἅιδου σέβειν.,780.0,780.0,πόνος περισσός εἰμί ἐν ᾍδης σέβω
Χορός,"Ἔρως ἀνίκατε μάχαν, Ἔρως, ὃς ἐν κτήμασι πίπτεις,",,781.0,Ἔρως ἀνίκητος μάχη Ἔρως ὅς ἐν κτῆμα πίπτω
Χορός,"ὃς ἐν μαλακαῖς παρειαῖς νεάνιδος ἐννυχεύεις,",,782.0,ὅς ἐν μαλακός παρειά νεᾶνις ἐννυχεύω
Χορός,φοιτᾷς δ᾽ ὑπερπόντιος ἔν τ᾽ ἀγρονόμοις αὐλαῖς:,785.0,785.0,φοιτάω δ ὑπερπόντιος ἐν τ ἀγρονόμος αὐλή
Χορός,καί σ᾽ οὔτ᾽ ἀθανάτων φύξιμος οὐδεὶς,,786.0,καί σ οὔτ ἀθάνατος φύξιμος οὐδείς
Χορός,οὔθ᾽ ἁμερίων σέ γ᾽ ἀνθρώπων.  ὁ δ᾽ ἔχων μέμηνεν.,790.0,790.0,οὔθ ἡμέριος σύ γε ἄνθρωπος  ὁ δ ἔχω μαίνομαι
Χορός,"σὺ καὶ δικαίων ἀδίκους φρένας παρασπᾷς ἐπὶ λώβᾳ,",,791.0,σύ καί δίκαιος ἄδικος φρήν παρασπάω ἐπί λώβη
Χορός,σὺ καὶ τόδε νεῖκος ἀνδρῶν ξύναιμον ἔχεις ταράξας:,,792.0,σύ καί ὅδε νεῖκος ἀνήρ σύναιμος ἔχω ταράσσω
Χορός,νικᾷ δ᾽ ἐναργὴς βλεφάρων ἵμερος εὐλέκτρου,795.0,795.0,νικάω δ ἐναργής βλέφαρον ἵμερος εὔλεκτρος
Χορός,"νύμφας, τῶν μεγάλων πάρεδρος ἐν ἀρχαῖς",,796.0,νύμφη ὁ μέγας πάρεδρος ἐν ἀρχή
Χορός,"θεσμῶν.  ἄμαχος γὰρ ἐμπαίζει θεὸς, Ἀφροδίτα.",800.0,800.0,θεσμός  ἄμαχος γάρ ἐμπαίζω θεός Ἀφροδίτη
Χορός,νῦν δ᾽ ἤδη 'γὼ καὐτὸς θεσμῶν,,801.0,νῦν δ ἤδη ἐγώ αὐτός θεσμός
Χορός,ἔξω φέρομαι τάδ᾽ ὁρῶν ἴσχειν δ᾽,,802.0,ἔξω φέρω τάδ ὁράω ἴσχω δ
Χορός,οὐκέτι πηγὰς δύναμαι δάκρυ,,803.0,οὐκέτι πηγή δύναμαι δάκρυον
Χορός,τὸν παγκοίτην ὅθ᾽ ὁρῶ θάλαμον,,804.0,ὁ παγκοίτης ὅθ ὁράω θάλαμος
Χορός,τήνδ᾽ Ἀντιγόνην ἀνύτουσαν.,805.0,805.0,τήνδ Ἀντιγόνη ἀνύω
Ἀντιγόνη,"ὁρᾶτ᾽ ἔμ᾽, ὦ γᾶς πατρίας πολῖται, τὰν νεάταν ὁδὸν",,806.0,ὁρᾶτ ἐν ὦ γῆ πάτριος πολίτης ὁ νέατος ὁδός
Ἀντιγόνη,"στείχουσαν, νέατον δὲ φέγγος λεύσσουσαν ἀελίου,",,807.0,στείχω νέατος δέ φέγγος λεύσσω ἥλιος
Ἀντιγόνη,κοὔποτ᾽ αὖθις.  ἀλλά μ᾽ ὁ παγκοίτας Ἅιδας ζῶσαν ἄγει,810.0,810.0,κοὔποτ αὖθις  ἀλλά μ ὁ παγκοίτης ᾍδης ζάω ἄγω
Ἀντιγόνη,τὰν Ἀχέροντος,,811.0,ὁ Ἀχέρων
Ἀντιγόνη,"ἀκτάν, οὔθ᾽ ὑμεναίων ἔγκληρον, οὔτ᾽ ἐπινύμφειός",,812.0,ἀκτή οὔθ ὑμέναιος ἔγκληρος οὔτ ἐπινύμφειος
Ἀντιγόνη,"πώ μέ τις ὕμνος ὕμνησεν, ἀλλ᾽ Ἀχέροντι νυμφεύσω.",815.0,815.0,πω ἐγώ τις ὕμνος ὑμνέω ἀλλ Ἀχέρων νυμφεύω
Χορός,οὐκοῦν κλεινὴ καὶ ἔπαινον ἔχουσ᾽,,816.0,οὐκοῦν κλεινός καί ἔπαινος ἔχουσ
Χορός,"ἐς τόδ᾽ ἀπέρχει κεῦθος νεκύων,",,817.0,εἰς τόδ ἀπέρχομαι κεῦθος νέκυς
Χορός,οὔτε φθινάσιν πληγεῖσα νόσοις,,818.0,οὔτε φθινάς πλήσσω νόσος
Χορός,"οὔτε ξιφέων ἐπίχειρα λαχοῦσ᾽,",820.0,820.0,οὔτε ξίφος ἐπίχειρα λαχοῦσ
Χορός,ἀλλ᾽ αὐτόνομος ζῶσα μόνη δὴ,,821.0,ἀλλ αὐτόνομος ζάω μόνος δή
Χορός,θνητῶν Ἅιδην καταβήσει.,,822.0,θνητός ᾍδης καταβαίνω
Ἀντιγόνη,ἤκουσα δὴ λυγρότατον ὀλέσθαι τὰν Φρυγίαν ξέναν,,823.0,ἀκούω δή λυγρός ὄλλυμι ὁ Φρύγιος ξένος
Ἀντιγόνη,"Ταντάλου Σιπύλῳ πρὸς ἄκρῳ, τὰν κισσὸς ὡς ἀτενὴς",825.0,825.0,Τάνταλος Σίπυλος πρός ἄκρος ὁ κισσός ὡς ἀτενής
Ἀντιγόνη,"πετραία βλάστα δάμασεν, καί νιν ὄμβροι τακομέναν,",,826.0,πετραῖος βλάστη δαμάζω καί νιν ὄμβρος τήκω
Ἀντιγόνη,"ὡς φάτις ἀνδρῶν,",,827.0,ὡς φάτις ἀνήρ
Ἀντιγόνη,"χιών τ᾽ οὐδαμὰ λείπει, τέγγει δ᾽ ὑπ᾽ ὀφρύσι παγκλαύτοις",830.0,830.0,χιών τ οὐδαμός λείπω τέγγω δ ὑπό ὀφρύς πάγκλαυστος
Ἀντιγόνη,δειράδας:  ᾇ με δαίμων ὁμοιοτάταν κατευνάζει.,,831.0,δειράς  ὅς ἐγώ δαίμων ὁμοῖος κατευνάζω
Χορός,"ἀλλὰ θεός τοι καὶ θεογεννής,",,832.0,ἀλλά θεός σύ καί θεογεννής
Χορός,ἡμεῖς δὲ βροτοὶ καὶ θνητογενεῖς.,835.0,835.0,ἐγώ δέ βροτός καί θνητογενής
Χορός,καίτοι φθιμένῃ μέγα κἀκοῦσαι,,836.0,καίτοι φθίω μέγας ἀκούω
Χορός,τοῖς ἰσοθέοις σύγκληρα λαχεῖν.,,837.0,ὁ ἰσόθεος σύγκληρος λαγχάνω
Χορός,ζῶσαν καὶ ἔπειτα θανοῦσαν.,,838.0,ζάω καί ἔπειτα θνήσκω
Ἀντιγόνη,"οἴμοι γελῶμαι.  τί με, πρὸς θεῶν πατρῴων.",,839.0,οἴμοι γελάω  τίς ἐγώ πρός θεός πατρῷος
Ἀντιγόνη,"οὐκ οἰχομέναν ὑβρίζεις, ἀλλ᾽ ἐπίφαντον;",840.0,840.0,οὐ οἴχομαι ὑβρίζω ἀλλ ἐπίφαντος
Ἀντιγόνη,"ὦ πόλις, ὦ πόλεως πολυκτήμονες ἄνδρες:",,841.0,ὦ πόλις ὦ πόλις πολυκτήμων ἀνήρ
Ἀντιγόνη,ἰὼ Διρκαῖαι κρῆναι,,842.0,ἰώ Διρκαῖος κρήνη
Ἀντιγόνη,"Θήβας τ᾽ εὐαρμάτου ἄλσος, ἔμπας ξυμμάρτυρας ὔμμ᾽ ἐπικτῶμαι,",845.0,845.0,Θῆβαι τ εὐάρματος ἄλσος ἔμπας συμμάρτυς ὔμμ ἐπικτάομαι
Ἀντιγόνη,"οἵα φίλων ἄκλαυτος, οἵοις νόμοις",,846.0,οἷος φίλος ἄκλαυστος οἷος νόμος
Ἀντιγόνη,πρὸς ἕργμα τυμβόχωστον ἔρχομαι τάφου ποταινίου:,,847.0,πρός ἕργμα τυμβόχωστος ἔρχομαι τάφος ποταίνιος
Ἀντιγόνη,"ἰὼ δύστανος, βροτοῖς οὔτε νεκροῖς κυροῦσα",850.0,850.0,ἰώ δύστηνος βροτός οὔτε νεκρός κυρέω
Ἀντιγόνη,"μέτοικος οὐ ζῶσιν, οὐ θανοῦσιν.",,851.0,μέτοικος οὐ ζάω οὐ θνήσκω
Χορός,προβᾶσ᾽ ἐπ᾽ ἔσχατον θράσους,,852.0,προβᾶσ ἐπί ἔσχατος θράσος
Χορός,ὑψηλὸν ἐς Δίκας βάθρον,,853.0,ὑψηλός εἰς δίκη βάθρον
Χορός,"προσέπεσες, ὦ τέκνον, πολύ:",855.0,855.0,προσπίπτω ὦ τέκνον πολύς
Χορός,πατρῷον δ᾽ ἐκτίνεις τιν᾽ ἆθλον.,,856.0,πατρῷος δ ἐκτίνω τιν ἆθλος
Ἀντιγόνη,"ἔψαυσας ἀλγεινοτάτας ἐμοὶ μερίμνας,",,857.0,ψαύω ἀλγεινός ἐγώ μέριμνα
Ἀντιγόνη,πατρὸς τριπόλιστον οἶκτον τού τε πρόπαντος,,858.0,πατήρ τριπόλιστος οἶκτος τις τε πρόπας
Ἀντιγόνη,ἁμετέρου πότμου κλεινοῖς Λαβδακίδαισιν.,860.0,860.0,ἡμέτερος πότμος κλεινός Λαβδακίδης
Ἀντιγόνη,ἰὼ ματρῷαι λέκτρων,,861.0,ἰώ μητρῷος λέκτρον
Ἀντιγόνη,"ἆται κοιμήματά τ᾽ αὐτογέννητ᾽ ἐμῷ πατρὶ δυσμόρου ματρός,",865.0,865.0,ἄτη κοίμημα τ αὐτογέννητ ἐμός πατήρ δύσμορος μήτηρ
Ἀντιγόνη,οἵων ἐγώ ποθ᾽ ἁ ταλαίφρων ἔφυν:,,866.0,οἷος ἐγώ ποθ ὁ ταλαίφρων φύω
Ἀντιγόνη,πρὸς οὓς ἀραῖος ἄγαμος ἅδ᾽ ἐγὼ μέτοικος ἔρχομαι.,,867.0,πρός ὅς ἀραῖος ἄγαμος ἅδ ἐγώ μέτοικος ἔρχομαι
Ἀντιγόνη,"ἰὼ δυσπότμων κασίγνητε γάμων κυρήσας,",870.0,870.0,ἰώ δύσποτμος κασίγνητος γάμος κυρέω
Ἀντιγόνη,θανὼν ἔτ᾽ οὖσαν κατήναρές με.,,871.0,θνήσκω ἔτ εἰμί κατεναίρομαι ἐγώ
Χορός,"σέβειν μὲν εὐσέβειά τις,",,872.0,σέβω μέν εὐσέβεια τις
Χορός,κράτος δ᾽ ὅτῳ κράτος μέλει,,873.0,κράτος δ ὅστις κράτος μέλω
Χορός,παραβατὸν οὐδαμᾷ πέλει:,,874.0,παραβατός οὐδαμός πέλω
Χορός,σὲ δ᾽ αὐτόγνωτος ὤλεσ᾽ ὀργά.,875.0,875.0,σύ δ αὐτόγνωτος ὤλεσ ὀργή
Ἀντιγόνη,"ἄκλαυτος, ἄφιλος, ἀνυμέναιος ταλαίφρων ἄγομαι",,876.0,ἄκλαυστος ἄφιλος ἀνυμέναιος ταλαίφρων ἄγω
Ἀντιγόνη,τὰν πυμάταν ὁδόν.  οὐκέτι μοι τόδε,,877.0,ὁ πύματος ὁδός  οὐκέτι ἐγώ ὅδε
Ἀντιγόνη,λαμπάδος ἱερὸν ὄμμα,,878.0,λαμπάς ἱερός ὄμμα
Ἀντιγόνη,θέμις ὁρᾶν ταλαίνᾳ.,880.0,880.0,θέμις ὁράω τάλας
Ἀντιγόνη,τὸν δ᾽ ἐμὸν πότμον ἀδάκρυτον,,881.0,ὁ δ ἐμός πότμος ἀδάκρυτος
Ἀντιγόνη,οὐδεὶς φίλων στενάζει.,,882.0,οὐδείς φίλος στενάζω
Κρέων,"ἆρ᾽ ἴστ᾽, ἀοιδὰς καὶ γόους πρὸ τοῦ θανεῖν",,883.0,ἆρ ἴστ ἀοιδή καί γόος πρό ὁ θνήσκω
Κρέων,"ὡς οὐδ᾽ ἂν εἷς παύσαιτ᾽ ἄν, εἰ χρείη λέγειν;",,884.0,ὡς οὐδ ἄν εἷς παύσαιτ ἀνά εἰ χρή λέγω
Κρέων,οὐκ ἄξεθ᾽ ὡς τάχιστα; καὶ κατηρεφεῖ,885.0,885.0,οὐ ἄξεθ ὡς ταχύς καί κατηρεφής
Κρέων,"τύμβῳ περιπτύξαντες, ὡς εἴρηκ᾽ ἐγώ,",,886.0,τύμβος περιπτύσσω ὡς εἴρηκ ἐγώ
Κρέων,"ἄφετε μόνην ἔρημον, εἴτε χρῇ θανεῖν",,887.0,ἀφίημι μόνος ἐρῆμος εἴτε χρή θνήσκω
Κρέων,εἴτ᾽ ἐν τοιαύτῃ ζῶσα τυμβεύειν στέγῃ:,,888.0,εἴτ ἐν τοιοῦτος ζάω τυμβεύω στέγη
Κρέων,ἡμεῖς γὰρ ἁγνοὶ τοὐπὶ τήνδε τὴν κόρην,,889.0,ἐγώ γάρ ἁγνός ἐπί ὅδε ὁ κόρη
Κρέων,μετοικίας δ᾽ οὖν τῆς ἄνω στερήσεται.,890.0,890.0,μετοικία δ οὖν ὁ ἄνω στερέω
Ἀντιγόνη,"ὦ τύμβος, ὦ νυμφεῖον, ὦ κατασκαφὴς",,891.0,ὦ τύμβος ὦ νυμφεῖος ὦ κατασκαφής
Ἀντιγόνη,"οἴκησις ἀείφρουρος,  οἷ πορεύομαι",,892.0,οἴκησις ἀείφρουρος  ἕ πορεύω
Ἀντιγόνη,"πρὸς τοὺς ἐμαυτῆς, ὧν ἀριθμὸν ἐν νεκροῖς",,893.0,πρός ὁ ἐμαυτοῦ ὅς ἀριθμός ἐν νεκρός
Ἀντιγόνη,πλεῖστον δέδεκται Φερσέφασσ᾽ ὀλωλότων:,,894.0,πλεῖστος δέχομαι Φερσέφασσ ὄλλυμι
Ἀντιγόνη,ὧν λοισθία 'γὼ καὶ κάκιστα δὴ μακρῷ,895.0,895.0,ὅς λοίσθιος ἐγώ καί κακός δή μακρός
Ἀντιγόνη,"κάτειμι, πρίν μοι μοῖραν ἐξήκειν βίου.",,896.0,κάτειμι πρίν ἐγώ μοῖρα ἐξήκω βίος
Ἀντιγόνη,ἐλθοῦσα μέντοι κάρτ᾽ ἐν ἐλπίσιν τρέφω,,897.0,ἔρχομαι μέντοι κάρτ ἐν ἐλπίς τρέφω
