Name,Speech,verse_number,inferred_verse_number,lemmata
Ἀντιγόνη,"φίλη μὲν ἥξειν πατρί, προσφιλὴς δὲ σοί,",,898.0,φίλος μέν ἥκω πατήρ προσφιλής δέ σύ
Ἀντιγόνη,"μῆτερ, φίλη δὲ σοί, κασίγνητον κάρα:",,899.0,μήτηρ φίλος δέ σύ κασίγνητος κάρα
Ἀντιγόνη,ἐπεὶ θανόντας αὐτόχειρ ὑμᾶς ἐγὼ,900.0,900.0,ἐπεί θνήσκω αὐτόχειρ σύ ἐγώ
Ἀντιγόνη,ἔλουσα κἀκόσμησα κἀπιτυμβίους,,901.0,λούω κοσμέω ἐπιτύμβιος
Ἀντιγόνη,"χοὰς ἔδωκα.  νῦν δέ Πολύνεικες, τὸ σὸν",,902.0,χοή δίδωμι  νῦν δέ Πολυνείκης ὁ σός
Ἀντιγόνη,δέμας περιστέλλουσα τοιάδ᾽ ἄρνυμαι.,,903.0,δέμας περιστέλλω τοιάδ ἄρνυμαι
Ἀντιγόνη,καίτοι σ᾽ ἐγὼ 'τίμησα τοῖς φρονοῦσιν εὖ.,,904.0,καίτοι σ ἐγώ τιμάω ὁ φρονέω εὖ
Ἀντιγόνη,"οὐ γάρ ποτ᾽ οὔτ᾽ ἄν, εἰ τέκνων μήτηρ ἔφυν,",905.0,905.0,οὐ γάρ ποτ οὔτ ἀνά εἰ τέκνον μήτηρ φύω
Ἀντιγόνη,"οὔτ᾽ εἰ πόσις μοι κατθανὼν ἐτήκετο,",,906.0,οὔτ εἰ πόσις ἐγώ καταθνήσκω τήκω
Ἀντιγόνη,βίᾳ πολιτῶν τόνδ᾽ ἂν ᾐρόμην πόνον.,,907.0,βία πολίτης τόνδ ἄν αἴρω πόνος
Ἀντιγόνη,τίνος νόμου δὴ ταῦτα πρὸς χάριν λέγω;,,908.0,τίς νόμος δή οὗτος πρός χάρις λέγω
Ἀντιγόνη,"πόσις μὲν ἄν μοι κατθανόντος ἄλλος ἦν,",,909.0,πόσις μέν ἀνά ἐγώ καταθνήσκω ἄλλος εἰμί
Ἀντιγόνη,"καὶ παῖς ἀπ᾽ ἄλλου φωτός, εἰ τοῦδ᾽ ἤμπλακον,",910.0,910.0,καί παῖς ἀπό ἄλλος φώς εἰ τοῦδ ἀμπλακεῖν
Ἀντιγόνη,μητρὸς δ᾽ ἐν Ἅιδου καὶ πατρὸς κεκευθότοιν,,911.0,μήτηρ δ ἐν ᾍδης καί πατήρ κεύθω
Ἀντιγόνη,οὐκ ἔστ᾽ ἀδελφὸς ὅστις ἂν βλάστοι ποτέ.,,912.0,οὐ εἰμί ἀδελφός ὅστις ἄν βλαστάνω ποτέ
Ἀντιγόνη,τοιῷδε μέντοι σ᾽ ἐκπροτιμήσασ᾽ ἐγὼ,,913.0,τοιόσδε μέντοι σ ἐκπροτιμήσασ ἐγώ
Ἀντιγόνη,νόμῳ Κρέοντι ταῦτ᾽ ἔδοξ᾽ ἁμαρτάνειν,,914.0,νόμος Κρέων ταῦτ ἔδοξ ἁμαρτάνω
Ἀντιγόνη,"καὶ δεινὰ τολμᾶν, ὦ κασίγνητον κάρα.",915.0,915.0,καί δεινός τολμάω ὦ κασίγνητος κάρα
Ἀντιγόνη,καὶ νῦν ἄγει με διὰ χερῶν οὕτω λαβὼν,,916.0,καί νῦν ἄγω ἐγώ διά χείρ οὕτως λαμβάνω
Ἀντιγόνη,"ἄλεκτρον, ἀνυμέναιον, οὔτε του γάμου",,917.0,ἄλεκτρος ἀνυμέναιος οὔτε τις γάμος
Ἀντιγόνη,"μέρος λαχοῦσαν οὔτε παιδείου τροφῆς,",,918.0,μέρος λαγχάνω οὔτε παίδειος τροφή
Ἀντιγόνη,ἀλλ᾽ ὧδ᾽ ἔρημος πρὸς φίλων ἡ δύσμορος,,919.0,ἀλλ ὧδ ἐρῆμος πρός φίλος ὁ δύσμορος
Ἀντιγόνη,ζῶσ᾽ εἰς θανόντων ἔρχομαι κατασκαφάς.,920.0,920.0,ζῶσ εἰς θνήσκω ἔρχομαι κατασκαφή
Ἀντιγόνη,ποίαν παρεξελθοῦσα δαιμόνων δίκην;,,921.0,ποῖος παρεξέρχομαι δαίμων δίκη
Ἀντιγόνη,τί χρή με τὴν δύστηνον ἐς θεοὺς ἔτι,,922.0,τίς χρή ἐγώ ὁ δύστηνος εἰς θεός ἔτι
Ἀντιγόνη,βλέπειν; τίν᾽ αὐδᾶν ξυμμάχων; ἐπεί γε δὴ,,923.0,βλέπω σύ αὐδάω σύμμαχος ἐπεί γε δή
Ἀντιγόνη,"τὴν δυσσέβειαν εὐσεβοῦσ᾽, ἐκτησάμην.",,924.0,ὁ δυσσέβεια εὐσεβοῦσ κτάομαι
Ἀντιγόνη,"ἀλλ᾽ εἰ μὲν οὖν τάδ᾽ ἐστὶν ἐν θεοῖς καλά,",925.0,925.0,ἀλλ εἰ μέν οὖν τάδ εἰμί ἐν θεός καλός
Ἀντιγόνη,παθόντες ἂν ξυγγνοῖμεν ἡμαρτηκότες:,,926.0,πάσχω ἄν συγγιγνώσκω ἁμαρτάνω
Ἀντιγόνη,"εἰ δ᾽ οἵδ᾽ ἁμαρτάνουσι, μὴ πλείω κακὰ",,927.0,εἰ δ οἵδ ἁμαρτάνω μή πλείων κακός
Ἀντιγόνη,πάθοιεν ἢ καὶ δρῶσιν ἐκδίκως ἐμέ.,,928.0,πάσχω ἤ καί δράω ἔκδικος ἐγώ
Χορός,ἔτι τῶν αὐτῶν ἀνέμων αὑταὶ,,929.0,ἔτι ὁ αὐτός ἄνεμος αὐτός
Χορός,ψυχῆς ῥιπαὶ τήνδε γ᾽ ἔχουσιν.,930.0,930.0,ψυχή ῥιπή ὅδε γε ἔχω
Κρέων,τοιγὰρ τούτων τοῖσιν ἄγουσιν,,931.0,τοιγάρ οὗτος ὁ ἄγω
Κρέων,κλαύμαθ᾽ ὑπάρξει βραδυτῆτος ὕπερ.,,932.0,κλαύμαθ ὑπάρχω βραδυτής ὑπέρ
Ἀντιγόνη,"οἴμοι, θανάτου τοῦτ᾽ ἐγγυτάτω",,933.0,οἴμοι θάνατος τοῦτ ἐγγύς
Ἀντιγόνη,τοὔπος ἀφῖκται.,,934.0,ἔπος ἀφικνέομαι
Χορός,θαρσεῖν οὐδὲν παραμυθοῦμαι,935.0,935.0,θαρσέω οὐδείς παραμυθέομαι
Χορός,μὴ οὐ τάδε ταύτῃ κατακυροῦσθαι.,,936.0,μή οὐ ὅδε οὗτος κατακυρόω
Ἀντιγόνη,ὦ γῆς Θήβης ἄστυ πατρῷον,,937.0,ὦ γῆ Θήβη ἄστυ πατρῷος
Ἀντιγόνη,"καὶ θεοὶ προγενεῖς,",,938.0,καί θεός προγενής
Ἀντιγόνη,ἄγομαι δὴ κοὐκέτι μέλλω.,,939.0,ἄγω δή οὐκέτι μέλλω
Ἀντιγόνη,"λεύσσετε,   Θήβης οἱ κοιρανίδαι",940.0,940.0,λεύσσω   Θήβη ὁ κοιρανίδης
Ἀντιγόνη,"τὴν βασιλειδᾶν μούνην λοιπήν,",,941.0,ὁ βασιλείδης μόνος λοιπός
Ἀντιγόνη,"οἷα πρὸς οἵων ἀνδρῶν πάσχω,",,942.0,οἷος πρός οἷος ἀνήρ πάσχω
Ἀντιγόνη,τὴν εὐσεβίαν σεβίσασα.,,943.0,ὁ εὐσέβεια σεβίζω
Χορός,ἔτλα καὶ Δανάας οὐράνιον φῶς,,944.0,τλάω καί Δανάη οὐράνιος φάος
Χορός,ἀλλάξαι δέμας ἐν χαλκοδέτοις αὐλαῖς:,945.0,945.0,ἀλλάσσω δέμας ἐν χαλκόδετος αὐλή
Χορός,κρυπτομένα δ᾽ ἐν τυμβήρει θαλάμῳ κατεζεύχθη:,,946.0,κρύπτω δ ἐν τυμβήρης θάλαμος καταζεύγνυμι
Χορός,"καίτοι καὶ γενεᾷ τίμιος, ὦ παῖ παῖ,",,947.0,καίτοι καί γενεά τίμιος ὦ παῖς παῖς
Χορός,καὶ Ζηνὸς ταμιεύεσκε γονὰς χρυσορύτους.,950.0,950.0,καί Ζεύς ταμιεύω γονή χρυσόρρυτος
Χορός,ἀλλ᾽ ἁ μοιριδία τις δύνασις δεινά:,,951.0,ἀλλ ὁ μοιρίδιος τις δύνασις δεινός
Χορός,"οὔτ᾽ ἄν νιν ὄλβος οὔτ᾽ Ἄρης, οὐ πύργος, οὐχ ἁλίκτυποι",,952.0,οὔτ ἀνά νιν ὄλβος οὔτ Ἄρης οὐ πύργος οὐ ἁλίκτυπος
Χορός,κελαιναὶ νᾶες ἐκφύγοιεν.,,953.0,κελαινός ναῦς ἐκφεύγω
Χορός,"ζεύχθη δ᾽ ὀξύχολος παῖς ὁ Δρύαντος,",955.0,955.0,ζεύγνυμι δ ὀξύχολος παῖς ὁ Δρύας
Χορός,"Ἠδωνῶν βασιλεύς, κερτομίοις ὀργαῖς",,956.0,Ἠδωνοί βασιλεύς κερτόμιος ὀργή
Χορός,ἐκ Διονύσου πετρώδει κατάφαρκτος ἐν δεσμῷ.,,957.0,ἐκ Διόνυσος πετρώδης κατάφρακτος ἐν δεσμός
Χορός,οὕτω τᾶς μανίας δεινὸν ἀποστάζει,,958.0,οὕτως ὁ μανία δεινός ἀποστάζω
Χορός,ἀνθηρόν τε μένος.  κεῖνος ἐπέγνω μανίαις,960.0,960.0,ἀνθηρός τε μένος  ἐκεῖνος ἐπιγιγνώσκω μανία
Χορός,ψαύων τὸν θεὸν ἐν κερτομίοις γλώσσαις.,,961.0,ψαύω ὁ θεός ἐν κερτόμιος γλῶσσα
Χορός,"παύεσκε μὲν γὰρ ἐνθέους γυναῖκας εὔιόν τε πῦρ,",,962.0,παύω μέν γάρ ἔνθεος γυνή εὔιος τε πῦρ
Χορός,φιλαύλους τ᾽ ἠρέθιζε Μούσας.,965.0,965.0,φίλαυλος τ ἐρεθίζω Μοῦσα
Χορός,παρὰ δὲ κυανεᾶν πελάγει διδύμας ἁλὸς,,966.0,παρά δέ Κυάνεαι πέλαγος δίδυμος ἅλς
Χορός,ἀκταὶ Βοσπόριαι ἥδ᾽ ὁ Θρῃκῶν ἄξενος,,967.0,ἀκτή Βοσπόριος ἥδ ὁ Θρᾷξ ἄξενος
Χορός,"Σαλμυδησσός, ἵν᾽ ἀγχίπτολις Ἄρης",970.0,970.0,Σαλμυδησσός ἵνα ἀγχίπτολις Ἄρης
Χορός,δισσοῖσι Φινείδαις,,971.0,δισσός Φινείδης
Χορός,εἶδεν ἀρατὸν ἕλκος,,972.0,εἶδον ἀρατός ἕλκος
Χορός,τυφλωθὲν ἐξ ἀγρίας δάμαρτος,,973.0,τυφλόω ἐκ ἄγριος δάμαρ
Χορός,ἀλαὸν ἀλαστόροισιν ὀμμάτων κύκλοις,,974.0,ἀλαός ἀλάστορος ὄμμα κύκλος
Χορός,"ἀραχθέντων, ὑφ᾽ αἱματηραῖς",975.0,975.0,ἀράσσω ὑπό αἱματηρός
Χορός,χείρεσσι καὶ κερκίδων ἀκμαῖσιν.,,976.0,χείρ καί κερκίς ἀκμή
Χορός,κατὰ δὲ τακόμενοι μέλεοι μελέαν πάθαν,,977.0,κατά δέ τήκω μέλεος μέλεος πάθη
Χορός,"κλαῖον, ματρὸς ἔχοντες ἀνύμφευτον γονάν:",980.0,980.0,κλαίω μήτηρ ἔχω ἀνύμφευτος γονή
Χορός,ἁ δὲ σπέρμα μὲν ἀρχαιογόνων,,981.0,ὁ δέ σπέρμα μέν ἀρχαιόγονος
Χορός,"ἄντασ᾽ Ἐρεχθειδᾶν,",,982.0,ἄντασ Ἐρεχθειδᾶν
Χορός,τηλεπόροις δ᾽ ἐν ἄντροις,,983.0,τηλέπορος δ ἐν ἄντρον
Χορός,τράφη θυέλλαισιν ἐν πατρῴαις,,984.0,τρέφω θύελλα ἐν πατρῷος
Χορός,Βορεὰς ἅμιππος ὀρθόποδος ὑπὲρ πάγου,985.0,985.0,Βορεὰς ἅμιππος ὀρθόπους ὑπέρ πάγος
Χορός,θεῶν παῖς.  ἀλλὰ κἀπ᾽ ἐκείνᾳ,,986.0,θεός παῖς  ἀλλά ἀπό ἐκεῖνος
Χορός,"Μοῖραι μακραίωνες ἔσχον, ὦ παῖ.",,987.0,μοῖρα μακραίων ἔχω ὦ παῖς
Τειρεσίας,"Θήβης ἄνακτες, ἥκομεν κοινὴν ὁδὸν",,988.0,Θήβη ἄναξ ἥκω κοινός ὁδός
Τειρεσίας,δύ᾽ ἐξ ἑνὸς βλέποντε:  τοῖς τυφλοῖσι γὰρ,,989.0,δύ ἐκ εἷς βλέπω  ὁ τυφλόω γάρ
Τειρεσίας,αὕτη κέλευθος ἐκ προηγητοῦ πέλει.,990.0,990.0,οὗτος κέλευθος ἐκ προηγητής πέλω
Κρέων,"τί δ᾽ ἔστιν, ὦ γεραιὲ Τειρεσία, νέον;",,991.0,τίς δ εἰμί ὦ γεραιός Τειρεσίης νέος
Τειρεσίας,"ἐγὼ διδάξω, καὶ σὺ τῷ μάντει πιθοῦ.",,992.0,ἐγώ διδάσκω καί σύ ὁ μάντις πείθω
Κρέων,οὔκουν πάρος γε σῆς ἀπεστάτουν φρενός.,,993.0,οὔκουν πάρος γε σός ἀποστατέω φρήν
Τειρεσίας,τοιγὰρ δι᾽ ὀρθῆς τήνδ᾽ ἐναυκλήρεις πόλιν.,,994.0,τοιγάρ δι ὀρθός τήνδ ναυκληρέω πόλις
Κρέων,ἔχω πεπονθὼς μαρτυρεῖν ὀνήσιμα.,995.0,995.0,ἔχω πάσχω μαρτυρέω ὀνήσιμος
Τειρεσίας,φρόνει βεβὼς αὖ νῦν ἐπὶ ξυροῦ τύχης.,,996.0,φρονέω βαίνω αὖ νῦν ἐπί ξυρόν τύχη
Κρέων,τί δ᾽ ἔστιν; ὡς ἐγὼ τὸ σὸν φρίσσω στόμα.,,997.0,τίς δ εἰμί ὡς ἐγώ ὁ σός φρίσσω στόμα
Τειρεσίας,"γνώσει, τέχνης σημεῖα τῆς ἐμῆς κλύων.",,998.0,γιγνώσκω τέχνη σημεῖον ὁ ἐμός κλύω
Τειρεσίας,εἰς γὰρ παλαιὸν θᾶκον ὀρνιθοσκόπον,,999.0,εἰς γάρ παλαιός θᾶκος ὀρνιθοσκόπος
Τειρεσίας,"ἵζων, ἵν᾽ ἦν μοι παντὸς οἰωνοῦ λιμήν,",1000.0,1000.0,ἵζω ἵνα εἰμί ἐγώ πᾶς οἰωνός λιμήν
Τειρεσίας,"ἀγνῶτ᾽ ἀκούω φθόγγον ὀρνίθων, κακῷ",,1001.0,ἀγνῶτ ἀκούω φθόγγος ὄρνις κακός
Τειρεσίας,κλάζοντας οἴστρῳ καὶ βεβαρβαρωμένῳ.,,1002.0,κλάζω οἶστρος καί βαρβαρόομαι
Τειρεσίας,καὶ σπῶντας ἐν χηλαῖσιν ἀλλήλους φοναῖς,,1003.0,καί σπάω ἐν χηλή ἀλλήλων φονή
Τειρεσίας,ἔγνων:  πτερῶν γὰρ ῥοῖβδος οὐκ ἄσημος ἦν.,,1004.0,γιγνώσκω  πτερόν γάρ ῥοῖβδος οὐ ἄσημος εἰμί
Τειρεσίας,εὐθὺς δὲ δείσας ἐμπύρων ἐγευόμην,1005.0,1005.0,εὐθύς δέ δείδω ἔμπυρος γεύω
Τειρεσίας,βωμοῖσι παμφλέκτοισιν:  ἐκ δὲ θυμάτων,,1006.0,βωμός πάμφλεκτος  ἐκ δέ θῦμα
Τειρεσίας,"Ἥφαιστος οὐκ ἔλαμπεν, ἀλλ᾽ ἐπὶ σποδῷ",,1007.0,Ἥφαιστος οὐ λάμπω ἀλλ ἐπί σποδός
Τειρεσίας,μυδῶσα κηκὶς μηρίων ἐτήκετο,,1008.0,μυδάω κηκίς μηρία τήκω
Τειρεσίας,"κἄτυφε κἀνέπτυε, καὶ μετάρσιοι",,1009.0,τύφω ἀναπτύω καί μετάρσιος
Τειρεσίας,"χολαὶ διεσπείροντο, καὶ καταρρυεῖς",1010.0,1010.0,χολή διασπείρω καί καταρρυής
Τειρεσίας,μηροὶ καλυπτῆς ἐξέκειντο πιμελῆς.,,1011.0,μηρός καλυπτός ἔκκειμαι πιμελή
Τειρεσίας,"τοιαῦτα παιδὸς τοῦδ᾽ ἐμάνθανον πάρα,",,1012.0,τοιοῦτος παῖς τοῦδ μανθάνω παρά
Τειρεσίας,φθίνοντ᾽ ἀσήμων ὀργίων μαντεύματα.,,1013.0,φθίνοντ ἄσημος ὄργια μάντευμα
Τειρεσίας,"ἐμοὶ γὰρ οὗτος ἡγεμών, ἄλλοις δ᾽ ἐγώ.",,1014.0,ἐγώ γάρ οὗτος ἡγεμών ἄλλος δ ἐγώ
Τειρεσίας,καὶ ταῦτα τῆς σῆς ἐκ φρενὸς νοσεῖ πόλις.,1015.0,1015.0,καί οὗτος ὁ σός ἐκ φρήν νοσέω πόλις
Τειρεσίας,βωμοὶ γὰρ ἡμῖν ἐσχάραι τε παντελεῖς,,1016.0,βωμός γάρ ἐγώ ἐσχάρα τε παντελής
Τειρεσίας,πλήρεις ὑπ᾽ οἰωνῶν τε καὶ κυνῶν βορᾶς,,1017.0,πλήρης ὑπό οἰωνός τε καί κύων βορά
Τειρεσίας,τοῦ δυσμόρου πεπτῶτος Οἰδίπου γόνου.,,1018.0,ὁ δύσμορος πίπτω Οἰδίπους γόνος
Τειρεσίας,κᾆτ᾽ οὐ δέχονται θυστάδας λιτὰς ἔτι,,1019.0,εἰμί οὐ δέχομαι θυστάς λιτή ἔτι
Τειρεσίας,"θεοὶ παρ᾽ ἡμῶν οὐδὲ μηρίων φλόγα,",1020.0,1020.0,θεός παρ ἐγώ οὐδέ μηρία φλόξ
Τειρεσίας,οὐδ᾽ ὄρνις εὐσήμους ἀπορροιβδεῖ βοάς,,1021.0,οὐδ ὄρνις εὔσημος ἀπορροιβδέω βοή
Τειρεσίας,ἀνδροφθόρου βεβρῶτες αἵματος λίπος.,,1022.0,ἀνδροφθόρος βιβρώσκω αἷμα λίπος
Τειρεσίας,"ταῦτ᾽ οὖν, τέκνον, φρόνησον.  ἀνθρώποισι γὰρ",,1023.0,ταῦτ οὖν τέκνον φρονέω  ἄνθρωπος γάρ
Τειρεσίας,τοῖς πᾶσι κοινόν ἐστι τοὐξαμαρτάνειν:,,1024.0,ὁ πᾶς κοινός εἰμί ἐξαμαρτάνω
Τειρεσίας,"ἐπεὶ δ᾽ ἁμάρτῃ, κεῖνος οὐκέτ᾽ ἔστ᾽ ἀνὴρ",1025.0,1025.0,ἐπεί δ ἁμαρτάνω ἐκεῖνος οὐκέτ εἰμί ἀνήρ
Τειρεσίας,"ἄβουλος οὐδ᾽ ἄνολβος, ὅστις ἐς κακὸν",,1026.0,ἄβουλος οὐδ ἄνολβος ὅστις εἰς κακός
Τειρεσίας,πεσὼν ἀκῆται μηδ᾽ ἀκίνητος πέλῃ.,,1027.0,πίπτω ἀκέομαι μηδ ἀκίνητος πέλω
Τειρεσίας,αὐθαδία τοι σκαιότητ᾽ ὀφλισκάνει.,,1028.0,αὐθαδία σύ σκαιότητ ὀφλισκάνω
Τειρεσίας,ἀλλ᾽ εἶκε τῷ θανόντι μηδ᾽ ὀλωλότα,,1029.0,ἀλλ εἴκω ὁ θνήσκω μηδ ὄλλυμι
Τειρεσίας,κέντει:  τίς ἀλκὴ τὸν θανόντ᾽ ἐπικτανεῖν;,1030.0,1030.0,κεντέω  τις ἀλκή ὁ θανόντ ἐπικτείνω
Τειρεσίας,εὖ σοι φρονήσας εὖ λέγω.  τὸ μανθάνειν δ᾽,,1031.0,εὖ σύ φρονέω εὖ λέγω  ὁ μανθάνω δ
Τειρεσίας,"ἥδιστον εὖ λέγοντος, εἰ κέρδος λέγοι.",,1032.0,ἡδύς εὖ λέγω εἰ κέρδος λέγω
Κρέων,"ὦ πρέσβυ, πάντες ὥστε τοξόται σκοποῦ",,1033.0,ὦ πρέσβυς πᾶς ὥστε τοξότης σκοπός
Κρέων,"τοξεύετ᾽ ἀνδρὸς τοῦδε, κοὐδὲ μαντικῆς",,1034.0,τοξεύετ ἀνήρ ὅδε οὐδέ μαντικός
Κρέων,ἄπρακτος ὑμῖν εἰμι:  τῶν δ᾽ ὑπαὶ γένους,1035.0,1035.0,ἄπρακτος σύ εἰμί  ὁ δ ὑπό γένος
Κρέων,ἐξημπόλημαι κἀμπεφόρτισμαι πάλαι.,,1036.0,ἐξεμπολάω ἐμφορτίζομαι πάλαι
Κρέων,"κερδαίνετ᾽, ἐμπολᾶτε τἀπὸ Σάρδεων",,1037.0,κερδαίνετ ἐμπολάω ἀπό Σάρδεις
Κρέων,"ἤλεκτρον, εἰ βούλεσθε, καὶ τὸν Ἰνδικὸν",,1038.0,ἤλεκτρον εἰ βούλομαι καί ὁ Ἰνδικός
Κρέων,"χρυσόν:  τάφῳ δ᾽ ἐκεῖνον οὐχὶ κρύψετε,",,1039.0,χρυσός  τάφος δ ἐκεῖνος οὐ κρύπτω
Κρέων,"οὐδ᾽ εἰ θέλουσ᾽, οἱ Ζηνὸς αἰετοὶ βορὰν",1040.0,1040.0,οὐδ εἰ θέλουσ ὁ Ζεύς ἀετός βορά
Κρέων,"φέρειν νιν ἁρπάζοντες ἐς Διὸς θρόνους,",,1041.0,φέρω νιν ἁρπάζω εἰς Ζεύς θρόνος
Κρέων,οὐδ᾽ ὣς μίασμα τοῦτο μὴ τρέσας ἐγὼ,,1042.0,οὐδ ὡς μίασμα οὗτος μή τρέω ἐγώ
Κρέων,θάπτειν παρήσω κεῖνον:  εὖ γὰρ οἶδ᾽ ὅτι,,1043.0,θάπτω παρίημι ἐκεῖνος  εὖ γάρ οἶδ ὅτι
Κρέων,θεοὺς μιαίνειν οὔτις ἀνθρώπων σθένει.,,1044.0,θεός μιαίνω οὔτις ἄνθρωπος σθένος
Κρέων,"πίπτουσι δ᾽, ὦ γεραιὲ Τειρεσία, βροτῶν",1045.0,1045.0,πίπτω δ ὦ γεραιός Τειρεσίης βροτός
Κρέων,"χοἰ πολλὰ δεινοὶ πτώματ᾽ αἴσχρ᾽, ὅταν λόγους",,1046.0,ὁ πολύς δεινός πτώματ αἴσχρ ὅταν λόγος
Κρέων,αἰσχροὺς καλῶς λέγωσι τοῦ κέρδους χάριν.,,1047.0,αἰσχρός καλός λέγω ὁ κέρδος χάρις
Τειρεσίας,φεῦ.,,1048.0,φεῦ
Τειρεσίας,"ἆρ᾽ οἶδεν ἀνθρώπων τις, ἆρα φράζεται,",,1049.0,ἆρ οἶδα ἄνθρωπος τις ἆρα φράζω
Κρέων,τί χρῆμα; ποῖον τοῦτο πάγκοινον λέγεις;,,1050.0,τίς χρῆμα ποῖος οὗτος πάγκοινος λέγω
Τειρεσίας,ὅσῳ κράτιστον κτημάτων εὐβουλία;,1050.0,1050.5,ὅσος κράτιστος κτῆμα εὐβουλία
Κρέων,"ὅσῳπερ, οἶμαι,   μὴ φρονεῖν πλείστη βλάβη.",,1051.0,ὅσος οἴομαι   μή φρονέω πλεῖστος βλάβη
Τειρεσίας,ταύτης σὺ μέντοι τῆς νόσου πλήρης ἔφυς.,,1052.0,οὗτος σύ μέντοι ὁ νόσος πλήρης φύω
Κρέων,οὐ βούλομαι τὸν μάντιν ἀντειπεῖν κακῶς.,,1053.0,οὐ βούλομαι ὁ μάντις ἀντεῖπον κακός
Τειρεσίας,"καὶ μὴν λέγεις, ψευδῆ με θεσπίζειν λέγων.",,1054.0,καί μήν λέγω ψευδής ἐγώ θεσπίζω λέγω
Κρέων,τὸ μαντικὸν γὰρ πᾶν φιλάργυρον γένος.,1055.0,1055.0,ὁ μαντικός γάρ πᾶς φιλάργυρος γένος
Τειρεσίας,τὸ δ᾽ ἐκ τυράννων αἰσχροκέρδειαν φιλεῖ.,,1056.0,ὁ δ ἐκ τύραννος αἰσχροκέρδεια φιλέω
Κρέων,ἆρ᾽ οἶσθα ταγοὺς ὄντας ἃν λέγῃς λέγων;,,1057.0,ἆρ οἶδα ταγός εἰμί ὅς λέγω λέγω
Τειρεσίας,οἶδ᾽:  ἐξ ἐμοῦ γὰρ τήνδ᾽ ἔχεις σώσας πόλιν.,,1058.0,οἶδ  ἐκ ἐγώ γάρ τήνδ ἔχω σώζω πόλις
Κρέων,"σοφὸς σὺ μάντις, ἀλλὰ τἀδικεῖν φιλῶν.",,1059.0,σοφός σύ μάντις ἀλλά ἀδικέω φιλέω
Τειρεσίας,ὄρσεις με τἀκίνητα διὰ φρενῶν φράσαι.,1060.0,1060.0,ὄρνυμι ἐγώ ἀκίνητος διά φρήν φράζω
Κρέων,"κίνει, μόνον δὲ μὴ 'πὶ κέρδεσιν λέγων.",,1061.0,κινέω μόνος δέ μή ἐπί κέρδος λέγω
Τειρεσίας,οὕτω γὰρ ἤδη καὶ δοκῶ τὸ σὸν μέρος.,,1062.0,οὕτως γάρ ἤδη καί δοκέω ὁ σός μέρος
Κρέων,ὡς μὴ 'μπολήσων ἴσθι τὴν ἐμὴν φρένα.,,1063.0,ὡς μή ἐμπολάω εἰμί ὁ ἐμός φρήν
Τειρεσίας,ἀλλ᾽ εὖ γέ τοι κάτισθι μὴ πολλοὺς ἔτι,,1064.0,ἀλλ εὖ γε σύ κάτοιδα μή πολύς ἔτι
Τειρεσίας,"τρόχους ἁμιλλητῆρας ἡλίου τελεῖν,",1065.0,1065.0,τροχός ἁμιλλητήρ ἥλιος τελέω
Τειρεσίας,ἐν οἷσι τῶν σῶν αὐτὸς ἐκ σπλάγχνων ἕνα,,1066.0,ἐν ὅς ὁ σός αὐτός ἐκ σπλάγχνον εἷς
Τειρεσίας,"νέκυν νεκρῶν ἀμοιβὸν ἀντιδοὺς ἔσει,",,1067.0,νέκυς νεκρός ἀμοιβός ἀντιδίδωμι εἰμί
Τειρεσίας,ἀνθ᾽ ὧν ἔχεις μὲν τῶν ἄνω βαλὼν κάτω,,1068.0,ἀνθ ὅς ἔχω μέν ὁ ἄνω βάλλω κάτω
Τειρεσίας,"ψυχήν τ᾽ ἀτίμως ἐν τάφῳ κατῴκισας,",,1069.0,ψυχή τ ἄτιμος ἐν τάφος κατοικίζω
Τειρεσίας,ἔχεις δὲ τῶν κάτωθεν ἐνθάδ᾽ αὖ θεῶν,1070.0,1070.0,ἔχω δέ ὁ κάτωθεν ἐνθάδ αὖ θεός
Τειρεσίας,"ἄμοιρον, ἀκτέριστον, ἀνόσιον νέκυν.",,1071.0,ἄμοιρος ἀκτέριστος ἀνόσιος νέκυς
Τειρεσίας,ὧν οὔτε σοὶ μέτεστιν οὔτε τοῖς ἄνω,,1072.0,ὅς οὔτε σύ μέτειμι οὔτε ὁ ἄνω
Τειρεσίας,"θεοῖσιν, ἀλλ᾽ ἐκ σοῦ βιάζονται τάδε.",,1073.0,θεός ἀλλ ἐκ σύ βιάζω ὅδε
Τειρεσίας,τούτων σε λωβητῆρες ὑστεροφθόροι,,1074.0,οὗτος σύ λωβητήρ ὑστεροφθόρος
